{
  "global": {
    "DECISION_POLICY": "special",
    "ENABLE_SPECIAL_APPROVAL_RULE": true,
    "SPECIAL_APPROVAL_THRESHOLD": 40.0,
    "FAIL_FAST_GLOBAL": true,
    "NO_TAGS_UPLIFT": 1.17,
    "MAX_SECTION_SCORE": 30,
    "MAX_GAP_BETWEEN_TERMS": 2,
    "TOKEN_UNIT_FOR_GAPS": "\\S+",
    "ENABLE_PROXIMITY_DETECTION": true,
    "NOISE_PROFILE": "relaxed",
    "MIN_UNIQUE_TERMS_FOR_APPROVAL": 1,
    "MIN_SECTIONS_WITH_HITS_FOR_APPROVAL": 1,
    "REQUIRE_NON_WEAK_TERM_FOR_APPROVAL": false,
    "ERROR_POLICY": "flag",
    "MAX_ERROR_RATE": 0.05,
    "PONTUACAO_NIVEIS": {
      "1": 10,
      "2": 8,
      "3": 6,
      "4": 4,
      "5": 2
    },
    "LIMITES_APROVADO": {
      "1": 10,
      "2": 12,
      "3": 18,
      "4": 22,
      "5": null
    },
    "LIMITES_SINALIZADO": {
      "1": 6,
      "2": 6,
      "3": 6,
      "4": 7,
      "5": 12
    },
    "WEIGHTS": {
      "title": 2.0,
      "abstract": 1.0,
      "manual_tags": 1.5
    }
  },
  "fields": {
    "id": "key",
    "id_output": "ID",
    "title": "title",
    "abstract": "abstract",
    "manual_tags": "manual_tags"
  },
  "output": {
    "csv": false,
    "xlsx": true,
    "csv_sep": ";",
    "csv_decimal": ",",
    "csv_float_format": "%.2f",
    "xlsx_engine": "xlsxwriter",
    "xlsx_sheet_name": "resultados",
    "academic_package": true
  },
  "encoding": "utf-8-sig",
  "sep": ";"
}
